,category,title,series,episode_name,description,description2,tags,image,more,tags2,publication_date,rating,duration_sec
875,News,ABC News Video Lab,ABC News Video Lab,What is coercive control in domestic violence relationships?,The ABC News Video Lab explains the events and issues making news in Australia and around the world.,What is coercive control? Where is it a crime? And what movements are we seeing in Australia to criminalise it?,['ABC NEWS'],https://cdn.iview.abc.net.au/thumbs/i/nn/NN2102H014S00_6087b2c23eb9c_1920.jpg,No more information found,"['news', 'news24', 'news-explained', 'videolab']",2021-04-27 16:00:00,No data found,220
876,News,ABC News Video Lab,ABC News Video Lab,"Why we are heading to the Moon, again",The ABC News Video Lab explains the events and issues making news in Australia and around the world.,The federal government reached an agreement with NASA for an Australian made rover to fly to the moon. The last human footprints on the moon were made in 1972. Now there is a renewed interest in our closest celestial neighbour. Multiple governments as well as private industry are investing billions in future projects. But what is fuelling this second space race?,['ABC NEWS'],https://cdn.iview.abc.net.au/thumbs/i/13582142-16x9-xlarge-v2.jpg,No more information found,"['news', 'news24', 'videolab', 'videolab', 'news-explained', 'moon', 'space', 'travel', 'exploration', 'space', 'exploration']",2021-10-12 17:55:56,No data found,776
877,News,Australian Story,Australian Story,Series 2021 Sophie's Choice,"Putting the 'real' back into reality TV, the award-winning series with no narrator and no agendas, just authentic stories told in people's own words. For 26 years we have been telling the stories of extraordinary Australians.","Mao's Last Dancer Li Cunxin and his wife and daughter's dramatic story of sacrifice, questioning and the painful journey towards reconciliation.","['ABC TV', 'ABC NEWS', 'DOCUMENTARY']",https://cdn.iview.abc.net.au/thumbs/i/nc/NC2102Q009S00_6062af1aa3165_1280.jpg,No more information found,"['abc1', 'australia', 'news', 'docs', 'factual', 'current-affairs', 'monday-night', 'investigative-reporting', 'informative', 'people', 'culture', 'diversity', 'biography', 'revealing', 'compelling', 'emotional', 'a:retirees', 'a:established-parents', 'a:older-sink-dink', 'a:young-sink-dink', 'ns:be-inspired', 'ns:understand']",2021-04-12 20:31:40,No data found,1852
878,News,ABC Late News,ABC Late News,Thursday 31/3/2022,"End your day informed and up-to-date with the best coverage of today's top stories and the latest news. Michael Tetlow brings you a complete snapshot of what's happening in the cities and suburbs, regions and rural Australia.","End your day informed and up-to-date with the best coverage of today's top stories and the latest news. Michael Tetlow brings you a complete snapshot of what's happening in the cities and suburbs, regions and rural Australia.",['ABC NEWS'],https://cdn.iview.abc.net.au/thumbs/i/nu/NU2209W_61c26a49cb20c.jpg,No more information found,"['news', 'news24', 'bulletin']",2022-03-31 22:50:14,No data found,900
879,News,Afternoon Briefing,Afternoon Briefing,Monday 21/3/2022,"The daily destination for #auspol addicts. With a Federal Election due before the end of May, Greg Jennett will break political news and interrogate politicians, candidates and public officials on the big national issues.","Greg Jennett covers the day's top stories, speaking with Bridget Rollason, Avani Dias, Michael Bradley, Retired Major General Mick Ryan, Daniel Wordsworth, Caroline Bowler, plus a panel with Michael McCormack and Josh Wilson.","['ABC NEWS', 'PANEL & DISCUSSION']",https://cdn.iview.abc.net.au/thumbs/i/nu/NU2222V_61f72155373ab_3600.jpg,No more information found,"['news', 'news24', 'panel', 'politics']",2022-03-21 17:00:00,No data found,3600
880,News,Afternoon Briefing,Afternoon Briefing,Monday 7/3/2022,"The daily destination for #auspol addicts. With a Federal Election due before the end of May, Greg Jennett will break political news and interrogate politicians, candidates and public officials on the big national issues.","Greg Jennett covers today's top stories, with retired Rear Admiral Peter Briggs, SES Commissioner Carlene York, retired General Mick Ryan, Estonian Ambassador Kersti Eesmaa, Stuart Robert, Katy Gallagher and Dr Mark Schipp.","['ABC NEWS', 'PANEL & DISCUSSION']",https://cdn.iview.abc.net.au/thumbs/i/nu/NU2222V_61f72155373ab_3600.jpg,No more information found,"['news', 'news24', 'panel', 'politics']",2022-03-07 17:00:00,No data found,3480
881,News,Australian Story,Australian Story,Series 2019 The Good Fight,"Putting the 'real' back into reality TV, the award-winning series with no narrator and no agendas, just authentic stories told in people's own words. For 26 years we have been telling the stories of extraordinary Australians.","When ABC broadcaster Jill Emberson was told she had ovarian cancer, she opted to go public fighting the deadly disease, advocating for awareness and funding. Jill died on December 12, 2019, three months after this program was originally broadcast.","['ABC TV', 'ABC NEWS', 'DOCUMENTARY']",https://cdn.iview.abc.net.au/thumbs/i/nc/NC1902Q021S00_5d6f541d0077a_1280.jpg,No more information found,"['abc1', 'australia', 'news', 'docs', 'factual', 'current-affairs', 'monday-night', 'investigative-reporting', 'informative', 'people', 'culture', 'diversity', 'biography', 'revealing', 'compelling', 'emotional', 'a:retirees', 'a:established-parents', 'a:older-sink-dink', 'a:young-sink-dink', 'ns:be-inspired', 'ns:understand']",2019-11-01 17:00:00,No data found,1814
882,News,7.30,7.30,Monday 21/3/2022,"Leigh Sales presents Australia's leading nightly public affairs program, bringing you a unique perspective on the days issues, exclusive investigations and compelling interviews. Plus political analysis from Laura Tingle.","Alan Kohler looks at the rising cost of living in a 2-part special. Labor Senator Kimberley Kitching, who died earlier this month, has been farewelled in Melbourne. Leigh Sales interviews new SA premier Peter Malinauskas.","['ABC TV', 'ABC NEWS']",https://cdn.iview.abc.net.au/thumbs/i/nc/NC2201H045S00_62380e97efb5f_1920.jpg,No more information found,"['news24', 'abc1', 'news', 'current-affairs', 'abc-faves', '730', 'best-news24', 'investigative-reporting', 'budget', 'economy', 'finance', 'childcare', 'analysis', 'south-australia']",2022-03-21 20:00:00,No data found,1799
883,News,ABC News Stories,ABC News Stories,Star Casino inquiry continues,"Watch some of the special features, stories, interviews and explainers produced by ABC News to bring you a clearer understanding of the issues and events that affect you.",An inquiry's been told an internal investigation by star casino found it acted too late to address suspicions that money laundering was occurring in a junket room.,['ABC NEWS'],https://live-production.wcms.abc-cdn.net.au/8abcae0d442d5ce8dd62b4215a8a2f01?impolicy=wcms_crop_resize&cropH=576&cropW=1023&xPos=0&yPos=0&width=862&height=485,No more information found,"['news', 'news24', 'star-casino', 'money-laundering', 'star-casino-inquiry', 'new-south-wales']",2022-04-01 11:54:07,No data found,114
884,News,Four Corners,Four Corners,Series 2014 Being Me,"The longest running show on Australian TV, this award-winning current affairs documentary series is a powerhouse of investigative journalism - fearless and forensic, holding power to account through six decades and counting.","The story of girls and boys, born in the wrong body and their struggle to be who they are. Janine Cohen reports.","['ABC TV', 'ABC NEWS']",https://cdn.iview.abc.net.au/thumbs/i/nc/NC1404H043S00_6114c0fc73c14_1920.jpg,No more information found,"['abc1', 'news', 'newscaff', 'current-affairs', 'the-week-in-news', 'abc-faves']",2020-02-27 17:00:00,No data found,2746
885,News,Budget 2022: Opposition Reply,No data found,Budget 2022: Opposition Reply,Opposition Leader Anthony Albanese delivers his response to the 2022 Federal Budget in the Opposition's Reply Speech.,Opposition Leader Anthony Albanese delivers his response to the 2022 Federal Budget in the Opposition's Reply Speech.,['ABC NEWS'],https://cdn.iview.abc.net.au/thumbs/i/ns/NS2205C001S00_624239a1ee6cd_1920.jpg,No more information found,"['news', 'news24', 'current-affairs', 'budget', 'economy', 'finance', 'business', 'informative', 'politics', 'government', 'parliament', 'canberra', 'australia']",2022-03-31 20:00:00,No data found,2310
886,News,The Brief,The Brief,September: The Nuclear Option,"A fresh behind-the-scenes look at Australian politics, as the ABC's Parliament House Bureau takes you inside the latest political developments as we count down to the 2022 Federal Election.","A secret trip blows up in Scott Morrison's face. The new nuclear submarine agreement leaves France crying foul. Kristina Keneally parachutes into a safe seat, while a blind trust costs Christian Porter his ministerial career.",['ABC NEWS'],https://cdn.iview.abc.net.au/thumbs/i/nn/NN2113H008S00_61555abe22982_1920.jpg,No more information found,"['news', 'news24']",2021-10-02 10:00:00,No data found,900
887,News,The Bright Side,The Bright Side Clips,Age no barrier for teenage medical student,"Sabra Lane brings you a collection of stories that aim to inspire, engage and create hope where there is uncertainty. A look at the positive, solutions-based reporting from across the ABC.","Darwin teenager Peter Susanto, 15, is studying to become a doctor, and if all goes to plan he'll be fully qualified by the time he's 21. Nibir Khan reports.",['ABC NEWS'],https://live-production.wcms.abc-cdn.net.au/e48318ae8abe4b8bf6233029352e1fb5?impolicy=wcms_crop_resize&cropH=576&cropW=1023&xPos=0&yPos=0&width=862&height=485,Host Sabra Lane,"['news', 'videoclips', 'education', 'medicine', 'youth', 'northern', 'territory']",2022-03-27 11:38:35,No data found,106
888,News,The Business,The Business Extras,Now is not a good time to buy a new car? Here's why,"Australia's leading daily business and finance show, bringing you up to date on market moves, economic trends and the forces affecting consumers, employees and business owners big and small. Presented by Kathryn Robinson (Mon-Wed) and Alicia Barry (Thu).","Delivery times for popular car models have blown out to more than a year, as the war in Ukraine exacerbates supply chain issues, driving up the cost of new and used cars.",['ABC NEWS'],https://live-production.wcms.abc-cdn.net.au/d862b8e6170da9b520c35cd3aa5e0de4?impolicy=wcms_crop_resize&cropH=576&cropW=1023&xPos=0&yPos=0&width=862&height=485,No more information found,"['news', 'news24', 'finance', 'news-analysis', 'videoclips', 'car', 'used', 'cars', 'second', 'hand', 'cars', 'semiconductors', 'microchips', 'supply', 'chain', 'disruptions', 'vehicles', 'russia', 'ukraine', 'neon', 'australian', 'automotive', 'dealers', 'association', 'components', 'car', 'parts']",2022-03-22 20:31:00,No data found,209
889,News,The Bright Side,The Bright Side Clips,Elvis memorabilia makes it way from Graceland to Bendigo,"Sabra Lane brings you a collection of stories that aim to inspire, engage and create hope where there is uncertainty. A look at the positive, solutions-based reporting from across the ABC.",Hundreds of items owned by Elvis Presley are on show at an exhibition in Bendigo launched by his former wife Priscilla Presley.,['ABC NEWS'],https://live-production.wcms.abc-cdn.net.au/71576188fbb35db5ba1cfd9a0756a232?impolicy=wcms_crop_resize&cropH=576&cropW=1023&xPos=0&yPos=0&width=862&height=485,Host Sabra Lane,"['news', 'videoclips', 'elvis', 'presley', 'priscilla', 'presley', 'the', 'king', 'exhibition']",2022-03-21 16:34:20,No data found,103
890,News,Q+A,Q+A,The Cost of Climate and COVID,"Q+A is back to get more of the answers to your questions from the people who know. Get set for another year of lively debate and surprising, thought-provoking discussions that challenge our thinking on big and complex issues.","With millions of Australians in lockdown, Q+A looks at the crippling economic impact on businesses and individuals. Following the release of a landmark climate report, the panel discusses Australia's climate change response.","['ABC TV', 'ABC NEWS', 'PANEL & DISCUSSION']",https://cdn.iview.abc.net.au/thumbs/i/nc/NC2104H027S00_61145c9b8c5be_1280.jpg,"Host Virginia Trioli, David Speers, Stan Grant","['abc1', 'news', 'panel', 'current-affairs', 'politics', 'interviews', 'featured']",2021-08-12 21:33:24,No data found,3628
891,News,Foreign Correspondent,Foreign Correspondent,Series 2019 Insectageddon,Australia's leading international current affairs program uncovers the stories and people whose personal struggles and triumphs help to explain the big picture - told through compelling storytelling and rich cinematography.,"Foreign Correspondent travels to Europe to investigate the decline of the insect population, threatening entire ecosystems. Reporter Eric Campbell discovers the causes and the steps in place to reverse the decline.","['ABC TV', 'ABC NEWS']",https://cdn.iview.abc.net.au/thumbs/i/nc/NC1926H023S00_5d92e1c840125.jpg,No more information found,"['abc1', 'news', 'news24', 'current-affairs', 'current', 'events', 'international-affairs', 'investigative-reporting', 'featured']",2019-12-19 17:00:00,No data found,1718
892,News,The World,The World,Wednesday 30/3/2022,"Know what's going on in our world. Beverley O'Connor presents the latest international news and a complete look at today's events with reports from ABC News correspondents and interviews with experts, commentators and guests.","Beverley O'Connor brings you the latest international news including an update on Ukraine peace talks, PNG suggests a security partnership with Indonesia and Australia, and Imran Khan fights to keep his job as Pakistan's PM.",['ABC NEWS'],https://cdn.iview.abc.net.au/thumbs/i/nc/NC2208V063S00_6244d45b19c12_1920.jpg,No more information found,"['news24', 'news', 'current-affairs', 'best-news24', 'world-news', 'bulletin', 'international-affairs']",2022-03-30 23:00:00,No data found,3360
893,News,Four Corners,Four Corners,Series 2020 Black Summer,"The longest running show on Australian TV, this award-winning current affairs documentary series is a powerhouse of investigative journalism - fearless and forensic, holding power to account through six decades and counting.",They are the videos that stunned the world - images from the firegrounds capturing the ferocity of the bushfires that have raged across Australia. We bring you the people and the stories behind the heart-stopping footage.,"['ABC TV', 'ABC NEWS']",https://cdn.iview.abc.net.au/thumbs/i/nc/NC2003H001S00_5e376f8cef5af_1280.jpg,No more information found,"['abc1', 'news', 'current-affairs', 'investigative-reporting', 'monday-night', 'featured', 'bushfires']",2020-02-03 21:31:00,No data found,2917
894,News,China Tonight,China Tonight Extras,The death of street food in China?,"Stan Grant and Yvonne Yong take a fresh look at news from inside China. We go beyond the headlines of trade wars and global posturing to bring you stories of China's rise in the world, and the changes and challenges at home.","Once common, street food is becoming a rarity in China these days, with vendors being run out of town by city management.",['ABC NEWS'],https://cdn.iview.abc.net.au/thumbs/i/13569616-16x9-xlarge-v2.jpg,"Hosts Stan Grant, Yvonne Yong","['China', 'videoclips', 'china', 'food', 'chinese', 'food', 'chinese', 'culture']",2021-10-04 19:59:55,No data found,366
895,News,Australian Story,Australian Story,Series 2020 Lest We Forget: Australia and the Spanish Flu,"Putting the 'real' back into reality TV, the award-winning series with no narrator and no agendas, just authentic stories told in people's own words. For 26 years we have been telling the stories of extraordinary Australians.","For the first time on TV, an in-depth look at how Australia survived the influenza pandemic of 1918. Long-forgotten archival material not only provides a unique insight but shows uncanny parallels to the COVID-19 pandemic.","['ABC TV', 'ABC NEWS', 'DOCUMENTARY']",https://cdn.iview.abc.net.au/thumbs/i/nc/NC2002Q015S00_5ecdd61cd9668_1280.jpg,No more information found,"['abc1', 'australia', 'news', 'docs', 'factual', 'current-affairs', 'monday-night', 'investigative-reporting', 'informative', 'people', 'culture', 'diversity', 'biography', 'revealing', 'compelling', 'emotional', 'a:retirees', 'a:established-parents', 'a:older-sink-dink', 'a:young-sink-dink', 'ns:be-inspired', 'ns:understand']",2020-06-01 20:31:30,No data found,2046
896,News,Four Corners,Four Corners,Series 2020 The Cost Of Coronavirus,"The longest running show on Australian TV, this award-winning current affairs documentary series is a powerhouse of investigative journalism - fearless and forensic, holding power to account through six decades and counting.","The coronavirus outbreak created a public health emergency that unleashed a financial wrecking ball through our economy. Capturing history in the making David Speers follows the political scramble, with access to key players.","['ABC TV', 'ABC NEWS']",https://cdn.iview.abc.net.au/thumbs/i/nc/NC2003H011S00_5e97dc42e0d56_1920.jpg,No more information found,"['abc1', 'news', 'current-affairs', 'investigative-reporting', 'monday-night', 'featured']",2020-04-20 21:16:55,No data found,2746
897,News,Australian Story,Australian Story,Series 2020 Caught In The Act,"Putting the 'real' back into reality TV, the award-winning series with no narrator and no agendas, just authentic stories told in people's own words. For 26 years we have been telling the stories of extraordinary Australians.",Shane Jenek is the man behind drag queen superstar Courtney Act. It hasn't always been easy for Shane reconciling himself with Courtney's popularity but together they're conquering the world via reality television.,"['ABC TV', 'ABC NEWS', 'DOCUMENTARY']",https://cdn.iview.abc.net.au/thumbs/i/nc/NC2002Q005S00_5e6eafec4aa28_1280.jpg,No more information found,"['abc1', 'australia', 'news', 'docs', 'factual', 'current-affairs', 'monday-night', 'investigative-reporting', 'informative', 'people', 'culture', 'diversity', 'biography', 'revealing', 'compelling', 'emotional', 'a:retirees', 'a:established-parents', 'a:older-sink-dink', 'a:young-sink-dink', 'ns:be-inspired', 'ns:understand', 'lgbtqi', 'pop-culture']",2020-03-16 20:31:25,No data found,1827
898,News,ABC News Stories,ABC News Stories,Outgoing senator makes bullying allegations against former staffer,"Watch some of the special features, stories, interviews and explainers produced by ABC News to bring you a clearer understanding of the issues and events that affect you.",The outgoing Northern Territory Senator Sam McMahon has made damning bullying allegations against a former staffer from her office.,['ABC NEWS'],https://live-production.wcms.abc-cdn.net.au/0901080a87ec07a8687f4584b19adea2?impolicy=wcms_crop_resize&cropH=576&cropW=1023&xPos=0&yPos=0&width=862&height=485,No more information found,"['news', 'news24', 'northern', 'territory', 'nt', 'bullying', 'politics', 'parliament', 'senate']",2022-03-31 11:25:01,No data found,112
899,News,ABC News Stories,ABC News Stories,Solomon Islands Prime Minister defends security deal with China,"Watch some of the special features, stories, interviews and explainers produced by ABC News to bring you a clearer understanding of the issues and events that affect you.",The proposed pact has sparked fears Beijing could set up a permanent military presence in Solomon Islands. Evan Wasuka reports.,['ABC NEWS'],https://live-production.wcms.abc-cdn.net.au/636698cd4fac0d49559fea06e3ba2928?impolicy=wcms_crop_resize&cropH=576&cropW=1023&xPos=0&yPos=0&width=862&height=485,No more information found,"['news', 'news24', 'solomon', 'islands', 'federal', 'politics', 'national', 'security', 'scott', 'morrison', 'liberal', 'party', 'labor', 'party', 'china', 'manasseh', 'sogavare']",2022-03-29 19:05:09,No data found,111
900,News,ABC News SA,ABC News SA,Friday 1/4/2022,"News from where you live. ABC News SA brings you today's top stories, exclusive investigations and original reporting on the issues that matter to you. Presented by Jessica Harmsen (Mon-Thu) and Emma Rebellato (Fri-Sun).","News from where you live. ABC News SA brings you today's top stories, exclusive investigations and original reporting on the issues that matter to you. Presented by Jessica Harmsen (Mon-Thu) and Emma Rebellato (Fri-Sun).","['ABC TV', 'ABC NEWS']",https://cdn.iview.abc.net.au/thumbs/i/nu/NU2206S078S00_62312e3e65d9d_1920.jpg,No more information found,"['abc1', 'news', 'news24', 'bulletin', 'state-news']",2022-04-01 20:00:00,No data found,1800
901,News,Living With Fire,Living With Fire,Episode 3 Fighting Back,The bushfires that burnt through eastern and southern Australia in late 2019 and the beginning of 2020 were some of the worst in the world and recorded history. For millennia the Australian continent has been shaped by fire.,How does a farming region come back from devastating fires? Fires swept through south east Tasmania in 2012 destroying homes and killing livestock. But locals in this region were determined to keep their rural livelihoods.,"['ABC TV', 'ABC NEWS', 'REGIONAL AUSTRALIA']",https://cdn.iview.abc.net.au/thumbs/i/ra/RA1916Q003S00_5f6bff91ea06e_1280.jpg,No more information found,"['abc1', 'news', 'news24', 'australia', 'factual', 'regional', 'environment', 'outback', 'a:established-parents', 'a:older-sink-dink', 'ns:be-informed', 'informative', 'short']",2020-09-29 10:56:00,No data found,766
902,News,Q+A,Q+A,Australia's Climate Future,"Q+A is back to get more of the answers to your questions from the people who know. Get set for another year of lively debate and surprising, thought-provoking discussions that challenge our thinking on big and complex issues.","As world leaders prepare to gather in Glasgow for climate talks, can Australia's politicians finally agree on a policy to cut emissions and create a green economy?","['ABC TV', 'ABC NEWS', 'PANEL & DISCUSSION']",https://cdn.iview.abc.net.au/thumbs/i/nc/NC2104H037S00_616f5fa216fed_1280.jpg,"Host Virginia Trioli, David Speers, Stan Grant","['abc1', 'news', 'panel', 'current-affairs', 'politics', 'interviews', 'featured', 'climate', 'climate-change', 'environment', 'politics', 'economy']",2021-10-21 21:34:34,No data found,3545
903,News,Four Corners Classics,Four Corners Classics,The 1960s,"Since 1961, Four Corners has served the public interest by exposing scandals, triggering inquiries, firing debate and confronting taboos. Revisit this selection of important stories from the Four Corners archive.","With a staff of six and a weekly budget of 480, Four Corners made its debut on Saturday August 19, 1961. Recorded in Sydney, copies of the program were flown around the country for broadcast. Australia's first national TV current affairs program was on air.","['ABC TV', 'ABC NEWS']",https://cdn.iview.abc.net.au/thumbs/i/nn/NN1948H005S00_5e27a3136be23_1280.jpg,No more information found,"['abc1', 'news']",2020-09-30 10:00:00,No data found,1514
904,News,Insiders: From The Couch,Insiders: From The Couch,"Shane Wright, Sarah Martin and John Kehoe",Join our panel of experienced political reporters as they discuss the key political issues of the week.,"Insiders host David Speers discusses the week in politics with Shane Wright, Sarah Martin and John Kehoe.","['ABC NEWS', 'PANEL & DISCUSSION']",https://cdn.iview.abc.net.au/thumbs/i/nn/NN2202V_61f357cebf484_1280.jpg,No more information found,"['news', 'current-affairs', 'abc-faves', 'best-news24', 'panel', 'latest', 'interviews', 'news-analysis']",2022-03-27 10:00:00,No data found,2023
905,News,Australian Story,Australian Story,Series 2018 From Behind Bars,"Putting the 'real' back into reality TV, the award-winning series with no narrator and no agendas, just authentic stories told in people's own words. For 26 years we have been telling the stories of extraordinary Australians.","Serving a 30-year prison sentence for killing four of her young children, Kathleen Folbigg speaks for the first time about her case. As she seeks a judicial review, an independent forensic pathologist reviews the evidence.","['ABC TV', 'ABC NEWS', 'DOCUMENTARY']",https://cdn.iview.abc.net.au/thumbs/i/nc/NC1802Q019S00_5b7161b28c9ea_1024.jpg,No more information found,"['abc1', 'australia', 'news', 'docs', 'factual', 'current-affairs', 'monday-night', 'investigative-reporting', 'informative', 'people', 'culture', 'diversity', 'biography', 'revealing', 'compelling', 'emotional', 'a:retirees', 'a:established-parents', 'a:older-sink-dink', 'a:young-sink-dink', 'ns:be-inspired', 'ns:understand']",2019-02-15 07:00:00,No data found,2183
906,News,China Tonight,China Tonight Extras,Surya Deva on Uyghur persecution,"Stan Grant and Yvonne Yong take a fresh look at news from inside China. We go beyond the headlines of trade wars and global posturing to bring you stories of China's rise in the world, and the changes and challenges at home.",Surya Deva works with the UN Working Group on Business and Human Rights. He chats to Stan Grant about the alleged persecution of the Uyghur people in north western China.,['ABC NEWS'],https://cdn.iview.abc.net.au/thumbs/i/13390284-16x9-xlarge-v2.jpg,"Hosts Stan Grant, Yvonne Yong","['China', 'videoclips']",2021-06-16 08:55:28,No data found,371
