,category,title,series,episode_name,description,description2,tags,image,more,tags2,publication_date,rating,duration_sec
292,News,Heywire,Heywire,"Series 2017 Ranim Alkharabeh: Mount Gambier, SA",Heywire is young regional Australians telling it like it is. They share candid and courageous stories about life outside the big cities.,Leaving the war in Syria for a beautiful life in Australia.,['ABC NEWS'],https://cdn.iview.abc.net.au/thumbs/i/ra/RA1706H005S00_596f0414e3aaa_1280.jpg,No more information found,"['abc1', 'news', 'docs', 'aussie-docs', 'real-life', 'regional-people', 'regional', 'heywire', 'short', 'refugees']",2021-03-09 06:00:00,No data found,135
293,News,Foreign Correspondent: The Rise Of China,Foreign Correspondent: The Rise Of China,The Ka-Ching! Dynasty,"Since 2012 Foreign Correspondent has reported on the Rise of China during the Xi Jinping era. In this special series from the archives, we look back at some of the most interesting reporting by ABC correspondents in China.","Over the past decade Foreign Correspondent has reported on the Rise of China during the Xi Jinping era. In 2012 Stephen McDonell met the super-rich, as the number of millionaires and billionaires grew at a staggering rate.",['ABC NEWS'],https://cdn.iview.abc.net.au/thumbs/i/nc/NC2035H001S00_5fab190b1ca96_1280.jpg,No more information found,"['news', 'news24', 'international-affairs']",2020-11-28 21:00:00,No data found,1770
294,News,Way Out Ag,Way Out Ag,Series 2021 Green And Gold,"Innovation has always been part of Australian farming, from unusual crops to futuristic machines and mysterious methods. This series explores how doing things differently has long paid off. Welcome to Way Out Ag!","In 2019 Landline visited the only Australian farm producing edible pumpkin seeds. A pallet can sell for thirty thousand dollars. And when pressed, the rich green oil is green gold.","['ABC TV', 'ABC NEWS', 'REGIONAL AUSTRALIA']",https://cdn.iview.abc.net.au/thumbs/i/ra/RA2112Q_61a044ae5d217_1675.jpg,No more information found,"['abc1', 'news', 'news24', 'regional', 'farm', 'technology', 'informative', 'short', 'australia', 'factual', 'agriculture', 'farming', 'a:home-duties', 'a:retirees', 'a:older-sink-dink', 'ns:understand', 'ns:be-informed']",2021-12-01 12:00:00,No data found,607
295,News,RetroFocus Presents: Yesterday's News,RetroFocus Presents: Yesterday's News,Skylab is Falling,Join us for a deep-dive into the archives as we follow the surprising  and sometimes shocking  twists and turns of the most intriguing stories ever covered by ABC News.,"In July 1979 NASA assured the world their crippled space station would crash harmlessly into the ocean.  Instead, residents of Western Australia woke up one morning to find space junk strewn across their state.","['ABC NEWS', 'DOCUMENTARY']",https://cdn.iview.abc.net.au/thumbs/i/nn/NN2025H004S00_5ed985caad9dc_1280.jpg,No more information found,"['news', 'news24', 'retrofocus', 'docs', 'short']",2020-06-05 17:00:00,No data found,2884
296,News,The Anxiety Project,The Anxiety Project Clips,How to improve mental health literacy in schools,"ABC News explores the issue of anxiety by speaking with Australians who experience it, examining the risk factors and talking to experts about how to minimise the impact on everyday life.",A new program being trialled in Australian schools is aimed at improving mental health literacy and reducing stigma so kids understand how to get help.,['ABC NEWS'],https://live-production.wcms.abc-cdn.net.au/161b0eb483695c270cf949b1a92572a7?impolicy=wcms_crop_resize&cropH=576&cropW=1023&xPos=0&yPos=0&width=862&height=485,No more information found,"['news', 'news24', 'videoclips', 'mental', 'health', 'stigma', 'anxiety']",2022-03-14 13:28:42,No data found,290
297,News,Heywire,Heywire,"Series 2019 Raymond, Buttah Windee, WA",Heywire is young regional Australians telling it like it is. They share candid and courageous stories about life outside the big cities.,Raymond is growing fish in the outback to help keep his family together.,['ABC NEWS'],https://cdn.iview.abc.net.au/thumbs/i/ra/RA1907H001S00_5d2d7c474580c.jpg,No more information found,"['abc1', 'news', 'docs', 'aussie-docs', 'real-life', 'regional-people', 'regional', 'heywire2019', 'latest', 'history', 'education', 'short']",2019-07-18 18:00:00,G,135
298,News,ABC News Video Lab,ABC News Video Lab,Was the January 6th attack on the US Capitol an attempted coup?,The ABC News Video Lab explains the events and issues making news in Australia and around the world.,"January 6th was a moment of national trauma in America. And while the attack on the Capitol is regarded as an insurrection carried out by supporters of Donald Trump, was it in fact an attempted coup d'état? And is the US heading for a resurgence of political violence?",['ABC NEWS'],https://cdn.iview.abc.net.au/thumbs/i/13697628-16x9-xlarge-v2.jpg,No more information found,"['news', 'news24', 'videolab', 'videolab', 'news-explained', 'january', '6', 'capitol', 'riots', 'video-lab', 'coup', 'donald', 'trump']",2022-01-06 18:12:16,No data found,814
299,News,China Tonight,China Tonight Extras,"Author Yiyun Li on language, mental health and the 'weight' of history","Stan Grant and Yvonne Yong take a fresh look at news from inside China. We go beyond the headlines of trade wars and global posturing to bring you stories of China's rise in the world, and the changes and challenges at home.","A warning, this clips includes mention of suicide. Writer Yiyun Li has lived for more than half of her life in America, but her life in China and the struggle between what she sees as the 'I' versus the 'we' of the two cultures has been an ongoing struggle.",['ABC NEWS'],https://cdn.iview.abc.net.au/thumbs/i/13581508-16x9-xlarge-v2.jpg,"Hosts Stan Grant, Yvonne Yong","['China', 'videoclips']",2021-10-12 12:16:28,No data found,815
300,News,Wide Open Spaces,Wide Open Spaces,Episode 4 Remote Snappers,Australia has a long history of artists who have taken inspiration from the unique environment they live in. This Landline series looks at the people and places that celebrate the bush through art and photography.,"Ever wished you could ditch the office job for something a bit more magical? For two young Australians, their day jobs involve swimming with dolphins in the Gulf of Carpentaria and sleeping under the stars in the outback.",['ABC NEWS'],https://cdn.iview.abc.net.au/thumbs/i/ra/RA2111Q004S00_61931f6eac861.jpg,No more information found,"['news', 'news24', 'short']",2021-12-01 13:00:00,No data found,625
301,News,ABC Late News Weekend,ABC Late News Weekend,Sunday 27/3/2022,"Live across Australia, the latest from ABC News, following today's top stories and live coverage of events as they unfold. Plus comprehensive analysis, context and original investigations from ABC reporters around the world.","Gemma Veness presents the latest from ABC News, following today's top stories and coverage of events as they unfold. Plus original reporting, expert analysis and the updated news, sport, weather and information you need.",['ABC NEWS'],https://cdn.iview.abc.net.au/thumbs/i/nu/NU2256H026S00_623d43f2e4e95_1280.jpg,No more information found,"['news', 'news24']",2022-03-27 22:30:00,No data found,1680
302,News,Australian Story,Australian Story,Series 2021 The Godfather of Coral,"Putting the 'real' back into reality TV, the award-winning series with no narrator and no agendas, just authentic stories told in people's own words. For 26 years we have been telling the stories of extraordinary Australians.","Charlie Veron has spent his career underwater charting the world's coral wonderlands. Now, as the Great Barrier Reef faces its biggest threat, he reveals an audacious rescue plan.","['ABC TV', 'ABC NEWS', 'DOCUMENTARY']",https://cdn.iview.abc.net.au/thumbs/i/nc/NC2102Q028S00_614adcc402a81_1920.jpg,No more information found,"['abc1', 'australia', 'news', 'docs', 'factual', 'current-affairs', 'monday-night', 'investigative-reporting', 'informative', 'people', 'culture', 'diversity', 'biography', 'revealing', 'compelling', 'emotional', 'a:retirees', 'a:established-parents', 'a:older-sink-dink', 'a:young-sink-dink', 'ns:be-inspired', 'ns:understand']",2021-10-04 20:31:30,No data found,1878
303,News,Q+A,Q+A,Trauma and Truth-Telling (27/5/2021),"Q+A is back to get more of the answers to your questions from the people who know. Get set for another year of lively debate and surprising, thought-provoking discussions that challenge our thinking on big and complex issues.","Q+A covers the big issues including the vaccine rollout, reconciliation and a ceasefire in the Gaza conflict. COVID restrictions return in Victoria with a 7 day circuit-breaker lockdown to bring the outbreak under control.","['ABC TV', 'ABC NEWS', 'PANEL & DISCUSSION']",https://cdn.iview.abc.net.au/thumbs/i/nc/NC2104H016S00_60aefdd1212a8_1280.jpg,"Host Virginia Trioli, David Speers, Stan Grant","['abc1', 'news', 'panel', 'current-affairs', 'politics', 'interviews', 'featured', 'uncleared']",2021-05-27 21:32:03,No data found,3405
304,News,Foreign Correspondent,Foreign Correspondent,Series 2020 Revolution In The Time Of Corona,Australia's leading international current affairs program uncovers the stories and people whose personal struggles and triumphs help to explain the big picture - told through compelling storytelling and rich cinematography.,"Lebanon's young and old, rich and poor, Muslim, Christian and Druze have united to try and overthrow corrupt and incompetent leaders. They face hyperinflation, currency collapse, high unemployment, power cuts and COVID-19.","['ABC TV', 'ABC NEWS']",https://cdn.iview.abc.net.au/thumbs/i/nc/NC2026H012S00_5ea8da9ab5e71_1280.jpg,No more information found,"['abc1', 'news', 'news24', 'current-affairs', 'current', 'events', 'international-affairs', 'investigative-reporting', 'featured']",2020-05-05 20:31:30,No data found,1799
305,News,ABC News Stories,ABC News Stories,Northern Territory's ICAC announces investigation into Rolfe arrest,"Watch some of the special features, stories, interviews and explainers produced by ABC News to bring you a clearer understanding of the issues and events that affect you.",An anti-corruption investigation has been launched to probe the lead up to Constable Zachary Rolfe being charged with murder over the fatal shooting of Kumanjayi Walker in 2019.,['ABC NEWS'],https://live-production.wcms.abc-cdn.net.au/7b1485c31da87936857b9aa6bfdbe0f7?impolicy=wcms_crop_resize&cropH=576&cropW=1023&xPos=0&yPos=0&width=862&height=485,No more information found,"['news', 'news24']",2022-03-30 08:22:07,No data found,228
306,News,Australian Story,Australian Story,Series 2019 Out Of The Blue,"Putting the 'real' back into reality TV, the award-winning series with no narrator and no agendas, just authentic stories told in people's own words. For 26 years we have been telling the stories of extraordinary Australians.","Minutes after entering the water in the Whitsundays, Tasmanian woman Justine Barwick was fighting for life following a shark bite. As the shark control debate continues, she tells her remarkable story for the first time.","['ABC TV', 'ABC NEWS', 'DOCUMENTARY']",https://cdn.iview.abc.net.au/thumbs/i/nc/NC1902Q034S00_5deeecab48fa2_1280.jpg,No more information found,"['abc1', 'australia', 'news', 'docs', 'factual', 'current-affairs', 'monday-night', 'investigative-reporting', 'informative', 'people', 'culture', 'diversity', 'biography', 'revealing', 'compelling', 'emotional', 'a:retirees', 'a:established-parents', 'a:older-sink-dink', 'a:young-sink-dink', 'ns:be-inspired', 'ns:understand']",2019-12-09 20:32:00,No data found,1835
307,News,Australian Story,Australian Story,Series 2019 Perfect Strangers,"Putting the 'real' back into reality TV, the award-winning series with no narrator and no agendas, just authentic stories told in people's own words. For 26 years we have been telling the stories of extraordinary Australians.","Emma and Richard Austin endured ten years of gruelling fertility treatment in their quest for a baby. Forced to abandon their dream, a surprise offer came from a couple facing the dilemma of managing their leftover embryos. The gift became baby Henry.","['ABC TV', 'ABC NEWS', 'DOCUMENTARY']",https://cdn.iview.abc.net.au/thumbs/i/nc/NC1902Q024S00_5d913a9c83f13_1280.jpg,No more information found,"['abc1', 'australia', 'news', 'docs', 'factual', 'current-affairs', 'monday-night', 'investigative-reporting', 'informative', 'people', 'culture', 'diversity', 'biography', 'revealing', 'compelling', 'emotional', 'a:retirees', 'a:established-parents', 'a:older-sink-dink', 'a:young-sink-dink', 'ns:be-inspired', 'ns:understand']",2019-11-01 17:00:00,No data found,1816
308,News,The Bright Side,The Bright Side Clips,Strawberry farmer turns berries to bottled jam,"Sabra Lane brings you a collection of stories that aim to inspire, engage and create hope where there is uncertainty. A look at the positive, solutions-based reporting from across the ABC.","'Lend a hand and buy some jam', Strawberry farmer turns berries to bottled jam and asks people to support small businesses until restrictions ease.",['ABC NEWS'],https://cdn.iview.abc.net.au/thumbs/i/13548058-16x9-xlarge-v2.jpg,Host Sabra Lane,"['news', 'videoclips', 'jam', 'farmer', 'strawberries']",2021-09-18 12:34:14,No data found,239
309,News,The Drum,The Drum,Friday 1/4/2022,"A tapestry of voices with a range of opinions and viewpoints. Ellen Fanning and Julia Baird lead the conversations that will get the nation talking, joined by our informed panel plus revealing discussions with special guests.","Ellen Fanning is joined by John Barilaro, Rick Morton, Feyi Akindoyeni, and Catherine Liddle to discuss Hillsong, growing up in country Australia, and Labor's budget reply - will its focus on aged care resonate with voters?","['ABC TV', 'ABC NEWS', 'PANEL & DISCUSSION']",https://cdn.iview.abc.net.au/thumbs/i/nc/NC2207H_61e63dd5efec4.jpg,No more information found,"['abc1', 'news24', 'news', 'panel', 'election', 'best-news24', 'latest', 'news-analysis']",2022-04-01 19:00:00,No data found,3481
310,News,ABC News Video Lab,ABC News Video Lab,Wet weather gives rise to fungi,The ABC News Video Lab explains the events and issues making news in Australia and around the world.,"Significant rainfall over the last few months has sprouted a vast array of fungi in damp corners of gardens, parks and paddocks. Jenny Woodward explains the role of fungi in our ecosystems.",['ABC NEWS'],https://cdn.iview.abc.net.au/thumbs/i/nn/NN2102H011S00_607928c76cb2a_1920.jpg,No more information found,"['news', 'news24', 'news-explained', 'videolab']",2021-04-18 07:00:00,No data found,202
311,News,China Tonight,China Tonight Extras,Kaiser Kuo (Full Interview),"Stan Grant and Yvonne Yong take a fresh look at news from inside China. We go beyond the headlines of trade wars and global posturing to bring you stories of China's rise in the world, and the changes and challenges at home.",Is China the ‘grown teenager’ of the world? Stan Grant chats to podcaster Kaiser Kuo about the country’s contrast between the weight of history – and the modern nation it’s become.,['ABC NEWS'],https://cdn.iview.abc.net.au/thumbs/i/13435408-16x9-xlarge-v2.jpg,"Hosts Stan Grant, Yvonne Yong","['China', 'videoclips', 'kaiser', 'kuo', 'china', 'chinese', 'culture']",2021-07-07 14:23:26,No data found,751
312,News,ABC News Regional,ABC News Regional Extras,Community choir embraces people with dementia and carers,Miriam Corowa brings you a closer look at what's making headlines in regional and rural Australia. ABC News reporters across the country uncover the news and unique stories about what's really going on outside the big cities.,A community choir in Canberra that provides people with dementia and their carers with a safe space to sing and share has returned after a long lockdown hiatus. Produced by Donal Sheil.,['ABC NEWS'],https://live-production.wcms.abc-cdn.net.au/c0fd1ed76d9d074b8a99fca0abfdb63e?impolicy=wcms_crop_resize&cropH=576&cropW=1023&xPos=0&yPos=0&width=862&height=485,No more information found,"['news', 'news24', 'videoclips', 'regional-news', 'dementia', 'choir', 'community', 'singing', 'act']",2022-03-27 12:29:28,No data found,128
313,News,Four Corners,Four Corners,Series 2019 Extinction Nation,"The longest running show on Australian TV, this award-winning current affairs documentary series is a powerhouse of investigative journalism - fearless and forensic, holding power to account through six decades and counting.","Australia has one of the worst extinction rates on the planet, and growing. Four Corners goes into the field with leading scientists and conservation volunteers to document first hand the fight to save these wild creatures.","['ABC TV', 'ABC NEWS']",https://cdn.iview.abc.net.au/thumbs/i/nc/NC1903H020S00_5d0c5bed97f0d_1280.jpg,No more information found,"['abc1', 'news', 'current-affairs', 'abc-faves', 'investigative-reporting', 'logies']",2020-02-17 18:00:00,No data found,2429
314,News,Four Corners,Four Corners,Series 2019 Rebellion: On The Frontline of Hong Kong's Uprising,"The longest running show on Australian TV, this award-winning current affairs documentary series is a powerhouse of investigative journalism - fearless and forensic, holding power to account through six decades and counting.","As pro-democracy flash mob protestors rose up against mainland Chinese rule, Four Corners was on the frontline to witness first-hand the escalating violence and chaos on the streets of Hong Kong. (Recorded in August 2019)","['ABC TV', 'ABC NEWS']",https://cdn.iview.abc.net.au/thumbs/i/nc/NC1903H030S00_5d68c625ef7c3_1280.jpg,No more information found,"['abc1', 'news', 'current-affairs', 'abc-faves', 'investigative-reporting', 'logies']",2020-02-17 18:00:00,No data found,3037
315,News,ABC News Regional,ABC News Regional,Saturday 26/3/2022,Miriam Corowa brings you a closer look at what's making headlines in regional and rural Australia. ABC News reporters across the country uncover the news and unique stories about what's really going on outside the big cities.,"Guy Stayner looks at stories from across regional Australia including calls for urgent financial assistance as flood devastated communities consider their futures, traditional owners launch an international legal challenge against a $5billion gas project in the Timor Sea and the competition is on to find Australia's top sheep dog.",['ABC NEWS'],https://cdn.iview.abc.net.au/thumbs/i/nc/NC2227H010S00_62312b449e415_1280.jpg,No more information found,"['news', 'news24', 'best-news24']",2022-03-26 12:30:00,No data found,1680
316,News,ABC News Regional,ABC News Regional Extras,Jockey Kerrin McEvoy immortalised in statue,Miriam Corowa brings you a closer look at what's making headlines in regional and rural Australia. ABC News reporters across the country uncover the news and unique stories about what's really going on outside the big cities.,A new statue of jockey Kerrin McEvoy has been revealed in Streaky Bay thanks to the fundraising efforts of its proud locals.,['ABC NEWS'],https://live-production.wcms.abc-cdn.net.au/56f017a47919063e1d81adb534d3d630?impolicy=wcms_crop_resize&cropH=576&cropW=1023&xPos=0&yPos=0&width=862&height=485,No more information found,"['news', 'news24', 'videoclips', 'regional-news', 'kerrin', 'mcevoy', 'melbourne', 'cup', 'jockey', 'statue', 'streaky', 'bay', 'south-australia', 'sa']",2022-03-28 14:39:03,No data found,108
317,News,Foreign Correspondent,Foreign Correspondent,Series 2020 Tourist Mecca,Australia's leading international current affairs program uncovers the stories and people whose personal struggles and triumphs help to explain the big picture - told through compelling storytelling and rich cinematography.,"Sam Hawley gains rare access to the reclusive kingdom of Saudi Arabia as it begins a campaign to become a tourist destination. But is the notoriously repressive, brutal regime ready to open itself up to the outside world?","['ABC TV', 'ABC NEWS']",https://cdn.iview.abc.net.au/thumbs/i/nc/NC2026H002S00_5e54577844499_1280.jpg,No more information found,"['abc1', 'news', 'news24', 'current-affairs', 'current', 'events', 'international-affairs', 'investigative-reporting', 'featured']",2020-02-25 20:31:50,No data found,1895
318,News,Australian Story,Australian Story,Series 2018 Unbreakable,"Putting the 'real' back into reality TV, the award-winning series with no narrator and no agendas, just authentic stories told in people's own words. For 26 years we have been telling the stories of extraordinary Australians.","Prince Harry spoke exclusively to Australian Story before the Invictus Games. We follow the extraordinary story of recovery by Garry Robinson, a former commando who narrowly survived a helicopter crash and competed in Sydney.","['ABC TV', 'ABC NEWS', 'DOCUMENTARY']",https://cdn.iview.abc.net.au/thumbs/i/nc/NC1802Q028S00_5bbfd779e13e5_1280.jpg,No more information found,"['abc1', 'australia', 'news', 'docs', 'factual', 'current-affairs', 'monday-night', 'investigative-reporting', 'informative', 'people', 'culture', 'diversity', 'biography', 'revealing', 'compelling', 'emotional', 'a:retirees', 'a:established-parents', 'a:older-sink-dink', 'a:young-sink-dink', 'ns:be-inspired', 'ns:understand', 'invictus', 'inside-invictus', 'sport', 'diversity', 'disability']",2019-02-15 07:00:00,No data found,1862
319,News,7.30 Mark Humphries Satire,7.30 Mark Humphries Satire,Parachuting candidates controversy continues,Satirist Mark Humphries brings his unique perspective on current political events for 7.30.,"In the lead-up to this year's federal election, the Labor Party has come under fire for efforts to parachute star candidates into electorates they don't live in - now another candidate has followed the trend.",['ABC NEWS'],https://cdn.iview.abc.net.au/thumbs/i/ma/MARK2022_61f215e60a6b9_1280.jpg,No more information found,"['news24', 'news', 'satire', 'parachuting', 'candidates', 'mark', 'humphries']",2022-03-31 20:55:47,No data found,136
320,News,The Beautiful Bush,The Beautiful Bush,Silo Art,Australia has a long history of artists who have taken inspiration from the unique environment they live in. This Landline series looks at the people and places that celebrate the bush through art and photography.,Coonalpyn is a small and declining South Australian town. In a bid to revitalize the community locals turned to an outsider to make an enormous artwork on their grain silos. Landline's Prue Adams reported in 2017.,"['ABC NEWS', 'REGIONAL AUSTRALIA', 'ARTS & CULTURE']",https://cdn.iview.abc.net.au/thumbs/i/ra/RA2108Q005S00_611b322e3a84f.jpg,No more information found,"['news', 'news24', 'regional', 'arts', 'environment', 'bushland', 'inspirational', 'lighthearted', 'short', 'south-australia', 'painting']",2021-09-04 14:00:00,No data found,1142
321,News,The Bright Side,The Bright Side,Quirky & Curious,"Sabra Lane brings you a collection of stories that aim to inspire, engage and create hope where there is uncertainty. A look at the positive, solutions-based reporting from across the ABC.","In Episode 2 of The Bright Side, Sabra Lane takes a look at some of the innovative and quirky solutions to some everyday problems.",['ABC NEWS'],https://cdn.iview.abc.net.au/thumbs/i/nc/NC2132T002S00_61c28e392ebe5_1280.jpg,Host Sabra Lane,"['news', 'news24']",2021-12-22 18:00:00,No data found,1137
322,News,Foreign Correspondent,Foreign Correspondent,Series 2021 The Sinking Sea,Australia's leading international current affairs program uncovers the stories and people whose personal struggles and triumphs help to explain the big picture - told through compelling storytelling and rich cinematography.,For millennia its waters healed the faithful. Now they're the source of conflict and tension. Eric Tlozek takes us on a spectacular journey through an ancient land to unravel the mystery of the disappearing Dead Sea.,"['ABC TV', 'ABC NEWS']",https://cdn.iview.abc.net.au/thumbs/i/nc/NC2110H010S00_60bd8c78562ae_1920.jpg,No more information found,"['abc1', 'news', 'news24', 'current-affairs', 'international-affairs', 'world-news', 'investigative-reporting', 'investigation', 'informative', 'revealing', 'challenging', 'cald', 'diversity']",2021-06-10 20:31:35,No data found,1808
323,News,Australian Story,Australian Story,Series 2021 Raising The Bar,"Putting the 'real' back into reality TV, the award-winning series with no narrator and no agendas, just authentic stories told in people's own words. For 26 years we have been telling the stories of extraordinary Australians.","Jennifer Robinson reveals the story behind her meteoric rise from public schoolgirl in small town NSW to the pinnacle of legal life in London, where she represents clients such as Julian Assange and actor Amber Heard.","['ABC TV', 'ABC NEWS', 'DOCUMENTARY']",https://cdn.iview.abc.net.au/thumbs/i/nc/NC2102Q007S00_60504c1959c8e_1280.jpg,No more information found,"['abc1', 'australia', 'news', 'docs', 'factual', 'current-affairs', 'monday-night', 'investigative-reporting', 'informative', 'people', 'culture', 'diversity', 'biography', 'revealing', 'compelling', 'emotional', 'a:retirees', 'a:established-parents', 'a:older-sink-dink', 'a:young-sink-dink', 'ns:be-inspired', 'ns:understand']",2021-03-22 20:31:15,No data found,1780
