,category,title,series,episode_name,description,description2,tags,image,more,tags2,publication_date,rating,duration_sec
584,News,ABC News NSW,ABC News NSW,Saturday 26/3/2022,"News from where you live. ABC News NSW brings you today's top stories, exclusive investigations and original reporting on the issues that matter to you. Presented by Juanita Phillips (Sun-Thu) and Jeremy Fernandez (Fri-Sat).","News from where you live. ABC News NSW brings you today's top stories, exclusive investigations and original reporting on the issues that matter to you. Presented by Juanita Phillips (Sun-Thu) and Jeremy Fernandez (Fri-Sat).","['ABC TV', 'ABC NEWS']",https://cdn.iview.abc.net.au/thumbs/i/nu/NU2201H073S00_62313460ee80a_1280.jpg,No more information found,"['abc1', 'news', 'news24', 'bulletin', 'state-news']",2022-03-26 19:30:00,No data found,1800
585,News,First Nation Farmers,First Nation Farmers,Series 1 Station Dreaming,For millennia Aboriginal and Torres Strait Islander peoples have harvested Australian flora and fauna for food. Landline presents stories from its archive exploring the past and future of Australia's First Nation Farmers.,"Meet members of a respected Indigenous farming family helping Indigenous youth get their life in order, and discover their own remarkable backstory.","['ABC TV', 'ABC NEWS', 'REGIONAL AUSTRALIA', 'INDIGENOUS', 'EDUCATION']",https://cdn.iview.abc.net.au/thumbs/i/ra/RA1917Q003S00_5f2b78aa27896_1920.jpg,No more information found,"['abc1', 'news', 'news24', 'iview', 'regional', 'short', 'indigenous', 'agriculture', 'farm', 'farming', 'people', 'outback', 'education', 'secondary-maths', 'australia', 'short']",2020-08-07 17:00:00,No data found,646
586,News,Australian Story,Australian Story,Series 2018 Blood On The Tracks (Part 1),"Putting the 'real' back into reality TV, the award-winning series with no narrator and no agendas, just authentic stories told in people's own words. For 26 years we have been telling the stories of extraordinary Australians.","When the body of Mark Haines was found on the train tracks near Tamworth in 1988, police quickly dismissed any idea of foul play. But after a 5 year investigation, journalist Allan Clarke believes he may have found the truth. Walkley Award Winner for Coverage of Indigenous Affairs.","['ABC TV', 'ABC NEWS', 'DOCUMENTARY']",https://cdn.iview.abc.net.au/thumbs/i/nc/NC1802Q016S00_5b0b44d8140c6_1280.jpg,No more information found,"['abc1', 'australia', 'news', 'docs', 'factual', 'current-affairs', 'monday-night', 'investigative-reporting', 'informative', 'people', 'culture', 'diversity', 'biography', 'revealing', 'compelling', 'emotional', 'a:retirees', 'a:established-parents', 'a:older-sink-dink', 'a:young-sink-dink', 'ns:be-inspired', 'ns:understand']",2019-02-15 07:00:00,No data found,1726
587,News,Australian Story,Australian Story,Series 2018 Pitch Perfect,"Putting the 'real' back into reality TV, the award-winning series with no narrator and no agendas, just authentic stories told in people's own words. For 26 years we have been telling the stories of extraordinary Australians.",The Matildas women's football team is riding high after a year of headline-grabbing wins. But the team's success has been decades in the making players have battled for equality and recognition for 40 years.,"['ABC TV', 'ABC NEWS', 'DOCUMENTARY']",https://cdn.iview.abc.net.au/thumbs/i/nc/NC1802Q006S00_5aa6502b194fe_1280.jpg,No more information found,"['abc1', 'australia', 'news', 'docs', 'factual', 'current-affairs', 'monday-night', 'investigative-reporting', 'informative', 'people', 'culture', 'diversity', 'biography', 'revealing', 'compelling', 'emotional', 'a:retirees', 'a:established-parents', 'a:older-sink-dink', 'a:young-sink-dink', 'ns:be-inspired', 'ns:understand', 'sport', 'football']",2019-02-15 07:00:00,No data found,1594
588,News,Q+A Highlights,Q+A Highlights,The PM's 'Grubby' Manchurian Rhetoric,"The show that puts you at the centre of the conversation. The highlights of Q+A as hosts Virginia Trioli, David Speers and Stan Grant are joined by a panel with diverse opinions to cover the topics that have everyone talking.","The Prime Minister's use of national security issues to smear the opposition was ""disgraceful, inaccurate and appalling,"" according to Labor MP Chris Bowen.","['ABC TV', 'ABC NEWS', 'PANEL & DISCUSSION']",https://cdn.iview.abc.net.au/thumbs/i/nn/NN2205H004S00_620ed8e87af2a_1920.jpg,No more information found,"['abc1', 'news', 'panel', 'current-affairs', 'politics', 'interviews', 'featured']",2022-02-18 10:00:00,No data found,936
589,News,Q+A Highlights,Q+A Highlights,Government Response to the Lismore Floods,"The show that puts you at the centre of the conversation. The highlights of Q+A as hosts Virginia Trioli, David Speers and Stan Grant are joined by a panel with diverse opinions to cover the topics that have everyone talking.","Naomi from Lismore shares her story from the disastrous floods in northern NSW, and asks why the government response has been ""so inadequate"".","['ABC TV', 'ABC NEWS', 'PANEL & DISCUSSION']",https://cdn.iview.abc.net.au/thumbs/i/nn/NN2205H014S00_622a8065625ea_1920.jpg,No more information found,"['abc1', 'news', 'panel', 'current-affairs', 'politics', 'interviews', 'featured']",2022-03-11 10:00:00,No data found,410
590,News,ABC News SA,ABC News SA,Thursday 31/3/2022,"News from where you live. ABC News SA brings you today's top stories, exclusive investigations and original reporting on the issues that matter to you. Presented by Jessica Harmsen (Mon-Thu) and Emma Rebellato (Fri-Sun).","News from where you live. ABC News SA brings you today's top stories, exclusive investigations and original reporting on the issues that matter to you. Presented by Jessica Harmsen (Mon-Thu) and Emma Rebellato (Fri-Sun).","['ABC TV', 'ABC NEWS']",https://cdn.iview.abc.net.au/thumbs/i/nu/NU2206S077S00_62312e351f2e7_1920.jpg,No more information found,"['abc1', 'news', 'news24', 'bulletin', 'state-news']",2022-03-31 20:00:00,No data found,1800
591,News,ABC News QLD,ABC News QLD,Saturday 26/3/2022,"News from where you live. ABC News QLD brings you today's top stories, exclusive investigations and original reporting on the issues that affect you. Presented by Matt Wordsworth (Mon-Thu) and Jessica van Vonderen (Fri-Sun).","News from where you live. ABC News QLD brings you today's top stories, exclusive investigations and original reporting on the issues that affect you. Presented by Matt Wordsworth (Mon-Thu) and Jessica van Vonderen (Fri-Sun).","['ABC TV', 'ABC NEWS']",https://cdn.iview.abc.net.au/thumbs/i/nu/NU2205Q073S00_623131aa208a1_1280.jpg,No more information found,"['abc1', 'news', 'news24', 'bulletin', 'state-news']",2022-03-26 20:30:00,No data found,1800
592,News,Afternoon Briefing,Afternoon Briefing,Friday 1/4/2022,"The daily destination for #auspol addicts. With a Federal Election due before the end of May, Greg Jennett will break political news and interrogate politicians, candidates and public officials on the big national issues.","Greg Jennett covers the day's top stories in politics and national affairs, speaking with international law expert Will Partlett, and Anti-Poverty Centre spokesperson Kristin O'Connell.","['ABC NEWS', 'PANEL & DISCUSSION']",https://cdn.iview.abc.net.au/thumbs/i/nu/NU2222V_61f72155373ab_3600.jpg,No more information found,"['news', 'news24', 'panel', 'politics']",2022-04-01 16:30:00,No data found,1800
593,News,ABC News With Auslan,ABC News With Auslan,Sunday 20/2/2022,The latest news and information from ABC News. This bulletin will be Auslan interpreted to provide accessible information to keep Australia's deaf community connected and informed. Presented by Miriam Corowa.,The latest news and information from ABC News. This bulletin will be Auslan interpreted to provide accessible information to keep Australia's deaf community connected and informed. Presented by Gemma Veness.,['ABC NEWS'],https://cdn.iview.abc.net.au/thumbs/i/nu/NU2271H014S00_6221a01bac992_1280.jpg,No more information found,"['news', 'news24']",2022-02-20 17:30:00,No data found,1680
594,News,ABC News VIC,ABC News VIC,Friday 1/4/2022,"News from where you live. ABC News Victoria brings you the day's top stories, exclusive investigations and original reporting on the issues that matter to you. Presented by Tamara Oudyn (Sun-Thu) and Mary Gearin (Fri-Sat).","News from where you live. ABC News Victoria brings you the day's top stories, exclusive investigations and original reporting on the issues that matter to you. Presented by Tamara Oudyn (Sun-Thu) and Mary Gearin (Fri-Sat).","['ABC TV', 'ABC NEWS']",https://cdn.iview.abc.net.au/thumbs/i/nu/NU2202V078S00_623133cb55777_1280.jpg,No more information found,"['abc1', 'news', 'news24', 'bulletin', 'state-news']",2022-04-01 19:30:00,No data found,1800
595,News,ABC News Stories,ABC News Stories,Biden's remarks may work in favour for Putin,"Watch some of the special features, stories, interviews and explainers produced by ABC News to bring you a clearer understanding of the issues and events that affect you.",US President Joe Biden's remarks may have overshadowed the meaning of his Europe trip. Carrington Clark reports.,['ABC NEWS'],https://live-production.wcms.abc-cdn.net.au/4a26644db79c3d4171563a75a9fa14ee?impolicy=wcms_crop_resize&cropH=576&cropW=1023&xPos=0&yPos=0&width=862&height=485,No more information found,"['news', 'news24', 'putin', 'joe', 'biden', 'usa', 'russia', 'ukraine', 'europe', 'war', 'president']",2022-03-28 11:02:06,No data found,99
596,News,China Tonight,China Tonight Extras,How does China's video game curfew work?,"Stan Grant and Yvonne Yong take a fresh look at news from inside China. We go beyond the headlines of trade wars and global posturing to bring you stories of China's rise in the world, and the changes and challenges at home.","Video games are hugely popular in China – so much so, the government’s gone to extra lengths to keep people’s game time at a reasonable amount. In fact… it might just be every parent’s dream?

Tech journo Angharad Yeo takes a look.",['ABC NEWS'],https://cdn.iview.abc.net.au/thumbs/i/13378592-16x9-xlarge-v2.jpg,"Hosts Stan Grant, Yvonne Yong","['China', 'videoclips']",2021-06-08 20:19:12,No data found,242
597,News,Australian Story,Australian Story,Series 2022 Fakes,"Putting the 'real' back into reality TV, the award-winning series with no narrator and no agendas, just authentic stories told in people's own words. For 26 years we have been telling the stories of extraordinary Australians.","After falling for a man whose life was a carefully constructed web of lies, journalist Stephanie Wood meets other women with uncannily similar experiences.","['ABC TV', 'ABC NEWS', 'DOCUMENTARY']",https://cdn.iview.abc.net.au/thumbs/i/nc/NC2202Q002S00_622e8c399fd10_1920.jpg,No more information found,"['abc1', 'australia', 'news', 'docs', 'factual', 'current-affairs', 'monday-night', 'investigative-reporting', 'informative', 'people', 'culture', 'diversity', 'biography', 'revealing', 'compelling', 'emotional']",2022-03-14 20:01:30,No data found,1930
598,News,Four Corners,Four Corners,Series 2021 Enslaved: Surviving a Sex Cult,"The longest running show on Australian TV, this award-winning current affairs documentary series is a powerhouse of investigative journalism - fearless and forensic, holding power to account through six decades and counting.","In a shocking investigation, Four Corners reveals how a sex slave cult has been operating in plain sight here in Australia.","['ABC TV', 'ABC NEWS']",https://cdn.iview.abc.net.au/thumbs/i/nc/NC2103H007S00_604eaa0214abb_1920.jpg,No more information found,"['abc1', 'news', 'current-affairs', 'investigative-reporting', 'investigation', 'revealing', 'informative', 'award-winning', 'monday-night', 'featured', 'ns:be-informed']",2021-03-15 21:19:48,No data found,2814
599,News,China Tonight,China Tonight,Monday 7/3/2022,"Stan Grant and Yvonne Yong take a fresh look at news from inside China. We go beyond the headlines of trade wars and global posturing to bring you stories of China's rise in the world, and the changes and challenges at home.",Stan Grant and Yvonne Yong return for a new season of China Tonight. China and Russia are closer and more powerful than ever before but where does China stand on the war in Ukraine? The real reason WeChat cancelled Scott Morrison. Plus the banned but booming business of fortune-telling.,['ABC NEWS'],https://cdn.iview.abc.net.au/thumbs/i/nc/NC2215H001S00_622588f6d1181_1920.jpg,"Hosts Stan Grant, Yvonne Yong","['news', 'news24', 'current-affairs', 'politics', 'world-news', 'factual', 'china', 'asia-pacific', 'informative', 'a:older-sink-dink', 'a:established-parents', 'ns:understand', 'ns:be-informed', 'australia']",2022-03-07 21:38:02,No data found,1781
600,News,The Brief,The Brief,March: Marching for justice,"A fresh behind-the-scenes look at Australian politics, as the ABC's Parliament House Bureau takes you inside the latest political developments as we count down to the 2022 Federal Election.",Thousands march on Parliament House demanding action to address years of toxic attitudes towards women. The Prime Minister insists he's listening but ends up having to apologise for raising false allegations.,['ABC NEWS'],https://cdn.iview.abc.net.au/thumbs/i/nn/NN2113H002S00_60654aeae5699_1920.jpg,No more information found,"['news', 'news24']",2021-04-03 06:00:00,No data found,917
601,News,Australian Story,Australian Story,Series 2021 Children of the Brush (Part 2),"Putting the 'real' back into reality TV, the award-winning series with no narrator and no agendas, just authentic stories told in people's own words. For 26 years we have been telling the stories of extraordinary Australians.","Part two of an inside look at one of Australia's greatest artistic dynasties. In this concluding episode, a court case threatens to derail the family of acclaimed painter John Olsen.","['ABC TV', 'ABC NEWS', 'DOCUMENTARY']",https://cdn.iview.abc.net.au/thumbs/i/nc/NC2102Q013S00_6092370d04e7e_1280.jpg,No more information found,"['abc1', 'australia', 'news', 'docs', 'factual', 'current-affairs', 'monday-night', 'investigative-reporting', 'informative', 'people', 'culture', 'diversity', 'biography', 'revealing', 'compelling', 'emotional', 'a:retirees', 'a:established-parents', 'a:older-sink-dink', 'a:young-sink-dink', 'ns:be-inspired', 'ns:understand']",2021-05-10 20:31:25,No data found,1794
602,News,The Bright Side,The Bright Side Clips,Free beer for 'tinnie heroes' who rescued families from flood,"Sabra Lane brings you a collection of stories that aim to inspire, engage and create hope where there is uncertainty. A look at the positive, solutions-based reporting from across the ABC.",Two men who used a tinnie to rescue families from their flooded homes in northern New South Wales have been rewarded with 'free beer for a year'. The Murwillumbah community thanked brothers Chad and Josh Curtis by giving them the beer in recognition of their heroics. Cathy Border reports...,['ABC NEWS'],https://live-production.wcms.abc-cdn.net.au/9b1acc9749e4b97f6358d84d61a9b657?impolicy=wcms_crop_resize&cropH=576&cropW=1023&xPos=0&yPos=0&width=862&height=485,Host Sabra Lane,"['news', 'videoclips', 'tinnie', 'heroes', 'flooding', 'flood']",2022-03-11 13:02:58,No data found,68
603,News,ABC News Regional,ABC News Regional Extras,Environmental concerns for WA's Leeuwin National Park,Miriam Corowa brings you a closer look at what's making headlines in regional and rural Australia. ABC News reporters across the country uncover the news and unique stories about what's really going on outside the big cities.,"Western Australia's most popular tourist destination attracts over four million visitors a year, but there are concerns the Leeuwin Naturaliste National Park in the Margaret River region is being loved to death. Anthony Pancia reports.",['ABC NEWS'],https://live-production.wcms.abc-cdn.net.au/bdb84804099074f2ef6602537a639e06?impolicy=wcms_crop_resize&cropH=576&cropW=1023&xPos=0&yPos=0&width=862&height=485,No more information found,"['news', 'news24', 'videoclips', 'regional-news', 'national', 'park', 'leeuwin', 'national', 'park', 'conservation', 'tourism', 'western-australia', 'western', 'australia', 'wa']",2022-03-21 13:49:54,No data found,140
604,News,Four Corners,Four Corners,Series 2021 Packer's Gamble,"The longest running show on Australian TV, this award-winning current affairs documentary series is a powerhouse of investigative journalism - fearless and forensic, holding power to account through six decades and counting.","A cautionary tale of big money, back room lobbying and political influence. As James Packer prepares to walk away from the casino business he championed, those who fought against Crown say there are lessons to be learned.","['ABC TV', 'ABC NEWS']",https://cdn.iview.abc.net.au/thumbs/i/nc/NC2103H017S00_60b06609458c7_1280.jpg,No more information found,"['abc1', 'news', 'current-affairs', 'investigative-reporting', 'investigation', 'revealing', 'informative', 'award-winning', 'monday-night', 'featured', 'ns:be-informed', 'australia', 'business', 'politics', 'corruption', 'scandal']",2021-05-31 21:18:20,No data found,2741
605,News,Foreign Correspondent,Foreign Correspondent,Series 2022 Trapped In Idlib,Australia's leading international current affairs program uncovers the stories and people whose personal struggles and triumphs help to explain the big picture - told through compelling storytelling and rich cinematography.,"Before Ukraine, there was Syria. Now in its 11th year, this ongoing conflict is Russia's forgotten war. Syrian journalist Yaman Khatib, who fled in 2016, returns to his homeland to see how people who stayed are faring.","['ABC TV', 'ABC NEWS']",https://cdn.iview.abc.net.au/thumbs/i/nc/NC2210H005S00_622844ec929a0_1920.jpg,No more information found,"['abc1', 'news', 'news24', 'current-affairs', 'international-affairs', 'world-news', 'investigative-reporting', 'investigation', 'informative', 'revealing', 'challenging', 'cald', 'diversity', 'war', 'conflict', 'history', 'military', 'syria', 'middle-east', 'russia']",2022-03-10 20:01:20,No data found,1767
606,News,ABC News NSW,ABC News NSW,Friday 1/4/2022,"News from where you live. ABC News NSW brings you today's top stories, exclusive investigations and original reporting on the issues that matter to you. Presented by Juanita Phillips (Sun-Thu) and Jeremy Fernandez (Fri-Sat).","News from where you live. ABC News NSW brings you today's top stories, exclusive investigations and original reporting on the issues that matter to you. Presented by Juanita Phillips (Sun-Thu) and Jeremy Fernandez (Fri-Sat).","['ABC TV', 'ABC NEWS']",https://cdn.iview.abc.net.au/thumbs/i/nu/NU2201H_61b82d095b2ea.jpg,No more information found,"['abc1', 'news', 'news24', 'bulletin', 'state-news']",2022-04-01 19:30:00,No data found,1800
607,News,ABC News Stories,ABC News Stories,Flood victims told to leave emergency housing to make way for Easter holiday-makers,"Watch some of the special features, stories, interviews and explainers produced by ABC News to bring you a clearer understanding of the issues and events that affect you.",Hundreds of people left homeless by the northern NSW floods have been told they will have to move out of their temporary accommodation because it's booked out for the Easter holidays.,['ABC NEWS'],https://live-production.wcms.abc-cdn.net.au/5d0483ac478d386cbb05b8c714124bc9?impolicy=wcms_crop_resize&cropH=576&cropW=1023&xPos=0&yPos=0&width=862&height=485,No more information found,"['news', 'news24', 'nsw', 'floods']",2022-04-01 20:04:54,No data found,277
608,News,The Beautiful Bush,The Beautiful Bush,Bush Sculptor,Australia has a long history of artists who have taken inspiration from the unique environment they live in. This Landline series looks at the people and places that celebrate the bush through art and photography.,"He was once a struggling artist battling to feed his family. Now Dubbo-based Brett ""Mon"" Garling is one of Australia's most in-demand sculptors. Landline's Sean Murphy reports.","['ABC NEWS', 'REGIONAL AUSTRALIA', 'ARTS & CULTURE']",https://cdn.iview.abc.net.au/thumbs/i/ra/RA2108Q001S00_611b322d7b8c2.jpg,No more information found,"['news', 'news24', 'regional', 'arts', 'environment', 'bushland', 'inspirational', 'lighthearted', 'short', 'sculpture', 'new-south-wales']",2021-09-04 14:00:00,No data found,661
609,News,Australian Story,Australian Story,Series 2021 The Tipping Point,"Putting the 'real' back into reality TV, the award-winning series with no narrator and no agendas, just authentic stories told in people's own words. For 26 years we have been telling the stories of extraordinary Australians.","Scientist Veena Sahajwalla is a recycling revolutionary whose bold new ideas are helping reduce landfill. Now she's unveiling her latest brainchild, an invention which turns the discarded into the designer.","['ABC TV', 'ABC NEWS', 'DOCUMENTARY']",https://cdn.iview.abc.net.au/thumbs/i/nc/NC2102Q003S00_602af068640a1_1280.jpg,No more information found,"['abc1', 'australia', 'news', 'docs', 'factual', 'current-affairs', 'monday-night', 'investigative-reporting', 'informative', 'people', 'culture', 'diversity', 'biography', 'revealing', 'compelling', 'emotional', 'a:retirees', 'a:established-parents', 'a:older-sink-dink', 'a:young-sink-dink', 'ns:be-inspired', 'ns:understand']",2021-02-22 20:31:45,No data found,1814
610,News,Wild Rides,Wild Rides,Saltwater Drovers,Action packed stories from the Australian bush and beyond. The ABC's Landline team heads to some of the country's most remote spots where dramatic musters and underground adventures are just part of life on the land.,Island farmers lead their herd of very expensive cattle across a watery passage in one of the most dramatic and unique musters in Australia.,"['ABC TV', 'ABC NEWS', 'REGIONAL AUSTRALIA']",https://cdn.iview.abc.net.au/thumbs/i/ra/RA1909Q002S00_5d3a53272c4fe.jpg,No more information found,"['abc1', 'news', 'news24', 'factual', 'regional', 'australia', 'regional-featured', 'short', 'people', 'outback', 'informative']",2019-07-26 17:00:00,No data found,293
611,News,Four Corners,Four Corners,Series 2022 State Control,"The longest running show on Australian TV, this award-winning current affairs documentary series is a powerhouse of investigative journalism - fearless and forensic, holding power to account through six decades and counting.","Exposing the stories of Australians who say they've been virtually abducted by the state, stripped of their assets and stopped from speaking out, until now. How a system designed to protect the vulnerable, does the opposite.","['ABC TV', 'ABC NEWS']",https://cdn.iview.abc.net.au/thumbs/i/nc/NC2203H006S00_622ab9a9d109c_1920.jpg,No more information found,"['abc1', 'news', 'current-affairs', 'investigative-reporting', 'investigation', 'revealing', 'informative', 'award-winning', 'monday-night', 'featured', 'ns:be-informed']",2022-03-14 21:20:05,No data found,2636
612,News,Foreign Correspondent,Foreign Correspondent,Series 2021 Women of the Revolution,Australia's leading international current affairs program uncovers the stories and people whose personal struggles and triumphs help to explain the big picture - told through compelling storytelling and rich cinematography.,"The women are rising. With their men jailed, Belarusian women have stepped on to the frontlines of the revolution. Inspired by a fearless great-grandmother, they won't give up till they've toppled their President.","['ABC TV', 'ABC NEWS']",https://cdn.iview.abc.net.au/thumbs/i/nc/NC2110H004S00_602dc54515504_1280.jpg,No more information found,"['abc1', 'news', 'news24', 'current-affairs', 'international-affairs', 'world-news', 'investigative-reporting', 'investigation', 'informative', 'revealing', 'challenging', 'cald', 'diversity']",2021-02-23 20:32:04,No data found,1790
613,News,ABC News NSW,ABC News NSW,Wednesday 30/3/2022,"News from where you live. ABC News NSW brings you today's top stories, exclusive investigations and original reporting on the issues that matter to you. Presented by Juanita Phillips (Sun-Thu) and Jeremy Fernandez (Fri-Sat).","News from where you live. ABC News NSW brings you today's top stories, exclusive investigations and original reporting on the issues that matter to you. Presented by Juanita Phillips (Sun-Thu) and Jeremy Fernandez (Fri-Sat).","['ABC TV', 'ABC NEWS']",https://cdn.iview.abc.net.au/thumbs/i/nu/NU2201H076S00_6231347fbb530_1280.jpg,No more information found,"['abc1', 'news', 'news24', 'bulletin', 'state-news']",2022-03-30 19:30:00,No data found,1800
614,News,ABC News At Noon Weekend,ABC News At Noon Weekend,Sunday 27/3/2022,"Miriam Corowa presents the latest from ABC News, following today's top stories and coverage of events as they unfold. Plus original reporting, expert analysis and all the updated news, sport, weather and information you need.","Alicia Barry presents the latest from ABC News, following today's top stories and coverage of events as they unfold. Plus original reporting, expert analysis and the updated news, sport, weather and information you need.","['ABC TV', 'ABC NEWS']",https://cdn.iview.abc.net.au/thumbs/i/nu/NU2246H_61ccefe79de03_1920.jpg,No more information found,"['abc1', 'news', 'news24', 'bulletin']",2022-03-27 12:30:00,No data found,1680
615,News,COP26: Towards Zero,No data found,No data found,"As world leaders gather in Glasgow for the UN Climate Change Summit COP26, ABC News brings you comprehensive coverage. Will we reach a global consensus on net zero emissions by 2050 and a pathway to 2030?",No data found,['ABC NEWS'],https://cdn.iview.abc.net.au/thumbs/i/ns/NS2118H_617f3db945b31_1920.jpg,Host Stan Grant,No data found,No data found,No data found,No data found
